Titel;Datum start;Datum eind;Korte beschrijving;procIDS
Voorbereiding;2023-01-01;2023-12-31;In de voorbereidingsfase zorgt het landelijk analyseteam voor de benodigde basis voor de komende analyses met het opstellen van een leidraad en beoordelingscriteria. Tegelijkertijd wordt gewerkt aan een concreet hoofddoel voor het Deltaprogramma Zoetwater. In deze fase worden ook de Provinciale Plannen voor het Landelijk Gebied (PPLG's) in concept gepubliceerd (juli 2023) en komt de Tussenbalans van het Kennisprogramma Zeespiegelstijging uit (november 2023).;proc01,proc02,proc03,proc04
Opgave en maatregelen;2024-01-01;2024-12-31;Bij het bepalen van de opgave en de maatregelen wordt een landelijke knelpuntenanalyse uitgevoerd en worden de mogelijke maatregelen beschreven door de zoetwaterregio's. In deze fase worden ook de Deltascenario's opgeleverd (januari 2024), wordt het Programma onder de Omgevingswet IRM (POW-IRM) gepubliceerd (mei 2024) en komen de definitieve PPLG's beschikbaar (september 2024).;proc05,proc06,proc07
Beoordeling en afweging;2025-01-01;2026-06-30;Tijdens de beoordeling en afweging worden de mogelijke zoetwatermaatregelen getrechterd naar drie verschillende maatregelpakketten (beleidsalternatieven). Daar worden sociaaleconomische analyses en validaties van kosten en effecten voor benut. In deze fase worden ook de resultaten van de adaptatiepaden van het Kennisprogramma Zeespiegelstijging gepubliceerd (januari 2025), wordt afgestemd over de concept-herijking van de Deltabeslissing Zoetwater (augustus 2025) en komt er meer duidelijkheid over het IRM-besluit over de afvoerverdeling en de rivierbodemligging (november 2025).;proc08,proc09,proc10,proc11,proc12,proc13
Besluitvorming;2026-07-01;2026-12-31;In de besluitvormingsfase wordt een besluit genomen over de voorkeursstrategie voor zoetwater en de concrete zoetwaterdoelen als deel van de tweede herijking van het Deltaprogramma. Ook wordt besloten welke maatregelpakketten tijdens de volgende fase worden uitgevoerd (2028-2033).;proc14,proc15
Borging;2027-01-01;2027-06-30;In de borgingsfase worden besluiten over de volgende fase van het Deltaprogramma Zoetwater geborgd in centraal en decentraal beleid.;
